{
  "$schema": "https://raw.githubusercontent.com/anthropic-community/claude-code-guardian/main/schemas/config.schema.json",
  "version": "1.0.0",

  "project": {
    "name": "",
    "type": "typescript-node",
    "root": "."
  },

  "modules": {
    "memory": {
      "enabled": true,
      "maxItems": 100,
      "autoSave": true,
      "persistPath": ".ccg/memory.db",
      "compressionEnabled": true
    },

    "guard": {
      "enabled": true,
      "strictMode": true,
      "rules": {
        "blockFakeTests": true,
        "blockDisabledFeatures": true,
        "blockEmptyCatch": true,
        "blockEmojiInCode": true,
        "blockSwallowedExceptions": true,
        "customRules": []
      }
    },

    "process": {
      "enabled": true,
      "ports": {
        "dev": 3000,
        "api": 8080,
        "test": 9000
      },
      "autoKillOnConflict": true,
      "trackSpawnedProcesses": true
    },

    "resource": {
      "enabled": true,
      "checkpoints": {
        "auto": true,
        "thresholds": [50, 70, 85, 95],
        "maxCheckpoints": 10,
        "compressOld": true
      },
      "warningThreshold": 70,
      "pauseThreshold": 95
    },

    "testing": {
      "enabled": true,
      "autoRun": false,
      "testCommand": "npm test",
      "browser": {
        "enabled": true,
        "headless": true,
        "captureConsole": true,
        "captureNetwork": true,
        "screenshotOnError": true
      },
      "cleanup": {
        "autoCleanTestData": true,
        "testDataPrefix": "test_",
        "testDataLocations": ["tmp", "test-data", ".test"]
      }
    },

    "documents": {
      "enabled": true,
      "locations": {
        "readme": "README.md",
        "docs": "docs",
        "api": "docs/api",
        "specs": "docs/specs",
        "changelog": "CHANGELOG.md"
      },
      "updateInsteadOfCreate": true,
      "namingConvention": "kebab-case"
    },

    "workflow": {
      "enabled": true,
      "autoTrackTasks": true,
      "requireTaskForLargeChanges": false,
      "largeChangeThreshold": 100
    }
  },

  "notifications": {
    "showInline": true,
    "showStatusBar": true,
    "verbosity": "normal",
    "sound": {
      "enabled": false,
      "criticalOnly": true
    }
  },

  "conventions": {
    "fileNaming": "kebab-case",
    "variableNaming": "camelCase",
    "componentNaming": "PascalCase",
    "noEmoji": true,
    "noUnicode": true
  }
}
